{
  "id": "conversion.join-card",
  "kind": "section",
  "name": "Wide join card",
  "category": "conversion",
  "designSystem": "marketing",
  "variants": [
    "default"
  ],
  "content": {
    "type": "object",
    "additionalProperties": false,
    "properties": {
      "heading": {
        "type": "string",
        "maxWords": 10,
        "measuredLongestRealInstance": "\"We want to help you grow\" = 6 words"
      },
      "body": {
        "type": "string",
        "maxWords": 20,
        "measuredLongestRealInstance": "10 words measured"
      },
      "cta": {
        "type": "object",
        "additionalProperties": false,
        "properties": {
          "label": {
            "type": "string",
            "maxWords": 4,
            "measuredLongestRealInstance": "\"Join Otter\" = 2 words"
          },
          "href": {
            "type": "string",
            "anyOf": [
              {
                "enum": [
                  "https://app.withotter.com/sign-up"
                ]
              },
              {
                "pattern": "^(https?://([a-z0-9-]+\\.)*[a-z0-9-]+\\.(example|invalid)(/[^\\s]*)?|mailto:[^@\\s]+@([a-z0-9-]+\\.)*[a-z0-9-]+\\.(example|invalid))$"
              }
            ],
            "x-cloneEnum": [
              "https://app.withotter.com/sign-up"
            ],
            "x-generationPattern": "url.placeholder",
            "x-modeNote": "mode:clone -> one of x-cloneEnum (CTA_HREF_NOT_NORMALISED). mode:generation -> a reserved .example/.invalid URL (GENERATION_MODE_URL); the source app host is rejected."
          },
          "variant": {
            "const": "button-primary"
          }
        },
        "required": [
          "label",
          "href",
          "variant"
        ]
      }
    },
    "required": [
      "heading",
      "body",
      "cta"
    ]
  },
  "constraints": {
    "homeRouteOnly": true,
    "onePerPage": true,
    "maxPerPage": 1,
    "note": "The only .button-primary on the whole site lives here."
  },
  "motion": {
    "allowedPatterns": [
      "none"
    ],
    "reducedMotionFallback": "none",
    "note": "No entrance or scroll animation. CSS hover transitions on .btn (colour trio, 300ms ease.outQuart) are global chrome behaviour, not section motion."
  },
  "responsive": {
    "desktop": "full-width col-lg-12 card, padding 64px, background-image join-bg.svg at 100% 0. Copy column max-width 50%. Measured 1200x423.2.",
    "le991": "background-position 160%.",
    "le767": "background-position 190%, padding 32px, copy max-width 75%.",
    "le479": "background-position 200px, copy max-width none."
  },
  "assetRoles": [],
  "observedOn": [
    "/"
  ],
  "measuredFrom": "CLONE_SPEC.md:388-400",
  "generatedAssetRoles": [],
  "retrievalEligible": true,
  "source": {
    "id": "HowItWorks.jsx:div.col.col-lg-12",
    "tag": "div",
    "file": "src/components/HowItWorks.jsx",
    "lines": "107-124"
  },
  "semantic": {
    "id": "conversion.join-card",
    "category": "CTA"
  }
}
